id,date,rawContent,replyCount,retweetCount,likeCount,quoteCount,lang,place,hashtags,mentionedUsers,user_id,user_name,user_renderedDescription,user_join_date,user_followers,user_location,user_verified,inReplyToTweetId,archivo,keyword
1190039650838204418,2019-10-31 22:55:37+00:00,Una posibilidad es convocar a un “plebiscito de entrada”  y que ciudadanos respondan si quieren o no modificar la actual Constitución y se pronuncien por la sede donde se va a discutir (Asamblea o Convención Constituyente). Me parece que solo el Congreso ya no es alternativa...,97,19,47,16,es,,,,103259570,matiaswalkerp,Abogado. Senador de la República por la Región de Coquimbo. Presidente Comisión de Constitución del Senado. #DemócratasChile,2010-01-09 12:29:35+00:00,69954,,True,1190038924829310981,Convencion_Constituyente_2019_Q4.csv,Convencion_Constituyente
1190014342122618902,2019-10-31 21:15:03+00:00,"@MiguelCrispiS @RDemocratica Muchas gracias! Porfa también informen de la otra opción, es decir, la convención constituyente, para entender sus diferencias, ventajas y desventajas.",0,0,0,0,es,,,"[User(username='MiguelCrispiS', id=57454967, displayname='Miguel Crispi Serrano', rawDescription=None, renderedDescription=None, descriptionLinks=None, verified=None, created=None, followersCount=None, friendsCount=None, statusesCount=None, favouritesCount=None, listedCount=None, mediaCount=None, location=None, protected=None, link=None, profileImageUrl=None, profileBannerUrl=None, label=None), User(username='RDemocratica', id=434511852, displayname='Revolución Democrática', rawDescription=None, renderedDescription=None, descriptionLinks=None, verified=None, created=None, followersCount=None, friendsCount=None, statusesCount=None, favouritesCount=None, listedCount=None, mediaCount=None, location=None, protected=None, link=None, profileImageUrl=None, profileBannerUrl=None, label=None)]",363668820,JavieraAntonia7,"Pienso, luego existo. Luego siento y me multiplico.",2011-08-28 13:58:30+00:00,27,"Santiago, Chile",False,1190013897283133440,Convencion_Constituyente_2019_Q4.csv,Convencion_Constituyente
1190005386016899073,2019-10-31 20:39:27+00:00,"@MiguelCrispiS @RDemocratica Amigxs, podrían explicar la diferencia entre una Asamblea Constituyente y una Convención Constituyente como las dos opciones para cambiar la Constitución? Además, por qué se inclinan por la primera. Muchas gracias!",1,0,1,0,es,,,"[User(username='MiguelCrispiS', id=57454967, displayname='Miguel Crispi Serrano', rawDescription=None, renderedDescription=None, descriptionLinks=None, verified=None, created=None, followersCount=None, friendsCount=None, statusesCount=None, favouritesCount=None, listedCount=None, mediaCount=None, location=None, protected=None, link=None, profileImageUrl=None, profileBannerUrl=None, label=None), User(username='RDemocratica', id=434511852, displayname='Revolución Democrática', rawDescription=None, renderedDescription=None, descriptionLinks=None, verified=None, created=None, followersCount=None, friendsCount=None, statusesCount=None, favouritesCount=None, listedCount=None, mediaCount=None, location=None, protected=None, link=None, profileImageUrl=None, profileBannerUrl=None, label=None)]",363668820,JavieraAntonia7,"Pienso, luego existo. Luego siento y me multiplico.",2011-08-28 13:58:30+00:00,27,"Santiago, Chile",False,1189972842970058752,Convencion_Constituyente_2019_Q4.csv,Convencion_Constituyente
1190004621680529408,2019-10-31 20:36:25+00:00,"@pablovidalrojas @RDemocratica @CatalinaPerezS @gblumel Amigxs, podrían explicar la diferencia entre una Asamblea Constituyente y una Convención Constituyente como las dos opciones para cambiar la Constitución? Además, por qué se inclinan por la primera. Muchas gracias!",0,0,0,0,es,,,"[User(username='pablovidalrojas', id=31346901, displayname='Pablo Vidal Rojas', rawDescription=None, renderedDescription=None, descriptionLinks=None, verified=None, created=None, followersCount=None, friendsCount=None, statusesCount=None, favouritesCount=None, listedCount=None, mediaCount=None, location=None, protected=None, link=None, profileImageUrl=None, profileBannerUrl=None, label=None), User(username='RDemocratica', id=434511852, displayname='Revolución Democrática', rawDescription=None, renderedDescription=None, descriptionLinks=None, verified=None, created=None, followersCount=None, friendsCount=None, statusesCount=None, favouritesCount=None, listedCount=None, mediaCount=None, location=None, protected=None, link=None, profileImageUrl=None, profileBannerUrl=None, label=None), User(username='CatalinaPerezS', id=157831773, displayname='Catalina Pérez Diputada', rawDescription=None, renderedDescription=None, descriptionLinks=None, verified=None, created=None, followersCount=None, friendsCount=None, statusesCount=None, favouritesCount=None, listedCount=None, mediaCount=None, location=None, protected=None, link=None, profileImageUrl=None, profileBannerUrl=None, label=None), User(username='GBlumel', id=1291431880135507968, displayname='Gomero Blumel', rawDescription=None, renderedDescription=None, descriptionLinks=None, verified=None, created=None, followersCount=None, friendsCount=None, statusesCount=None, favouritesCount=None, listedCount=None, mediaCount=None, location=None, protected=None, link=None, profileImageUrl=None, profileBannerUrl=None, label=None)]",363668820,JavieraAntonia7,"Pienso, luego existo. Luego siento y me multiplico.",2011-08-28 13:58:30+00:00,27,"Santiago, Chile",False,1189927274222624768,Convencion_Constituyente_2019_Q4.csv,Convencion_Constituyente
1189993525670232064,2019-10-31 19:52:20+00:00,"@facucruz Consulta, o sea que no se llama a convención constituyente? El proyecto lo presentan los actuales miembros del PL o eventualmente el PE, y tiene un tratamiento interno como otra ley cualquiera (excepto por los requisitos de mayorías especiales que explicaste?)",0,0,0,0,es,,,"[User(username='facucruz', id=114540325, displayname='Facu Cruz', rawDescription=None, renderedDescription=None, descriptionLinks=None, verified=None, created=None, followersCount=None, friendsCount=None, statusesCount=None, favouritesCount=None, listedCount=None, mediaCount=None, location=None, protected=None, link=None, profileImageUrl=None, profileBannerUrl=None, label=None)]",721167046650765314,gea_nqn,,2016-04-16 02:43:17+00:00,27,,False,1189966027410550784,Convencion_Constituyente_2019_Q4.csv,Convencion_Constituyente
1189970632647282688,2019-10-31 18:21:22+00:00,"Porque tratan de meternos su asamblea constituyente hasta x las orejas? Si hay otras maneras de cambiar la constitucion?.La mas justa , es la CONVENCION CONSTITUYENTE MIXTA..Esta es :parlamento +representates de la sociedad civil  . 
#asambleaconstituyenteYA NO!",1,0,0,0,es,,['asambleaconstituyenteYA'],,106087179,_Piel_Canela_,"#soydonante.
Aprendo de los errores,Amo la música",2010-01-18 13:14:54+00:00,176,,False,None,Convencion_Constituyente_2019_Q4.csv,Convencion_Constituyente
1189961641036853250,2019-10-31 17:45:38+00:00,@JuCosas Eso de Convencion Constituyente es la ruta q uso Hugo Chavez.,0,0,0,0,es,,,"[User(username='jucosas', id=305344035, displayname='Odiosa en el palco', rawDescription=None, renderedDescription=None, descriptionLinks=None, verified=None, created=None, followersCount=None, friendsCount=None, statusesCount=None, favouritesCount=None, listedCount=None, mediaCount=None, location=None, protected=None, link=None, profileImageUrl=None, profileBannerUrl=None, label=None)]",357558198,jonstjohn1,Journalist,2011-08-18 15:14:04+00:00,3429,USA,False,1189959432739917825,Convencion_Constituyente_2019_Q4.csv,Convencion_Constituyente
1189935521377726466,2019-10-31 16:01:50+00:00,"@RuyDiazRamirez @grandovich @sebastianpinera Perfecto hagamos un plebiscito en un mes y que la gente elija si quiere una nueva Constitución y el mecanismo: Asamblea Constituyente, Convención constituyente o comisión bicameral. Con plebiscito de salida para ratificar nuevo texto. Escuchemos a la gente.",0,0,0,0,es,,,"[User(username='RuyDiazRamirez', id=118355602, displayname='Rodrigo Díaz Ramírez', rawDescription=None, renderedDescription=None, descriptionLinks=None, verified=None, created=None, followersCount=None, friendsCount=None, statusesCount=None, favouritesCount=None, listedCount=None, mediaCount=None, location=None, protected=None, link=None, profileImageUrl=None, profileBannerUrl=None, label=None), User(username='grandovich', id=861012545485844484, displayname='EL ZORRO 🇨🇱 🍀 🇮🇪', rawDescription=None, renderedDescription=None, descriptionLinks=None, verified=None, created=None, followersCount=None, friendsCount=None, statusesCount=None, favouritesCount=None, listedCount=None, mediaCount=None, location=None, protected=None, link=None, profileImageUrl=None, profileBannerUrl=None, label=None), User(username='sebastianpinera', id=13623532, displayname='Sebastian Piñera', rawDescription=None, renderedDescription=None, descriptionLinks=None, verified=None, created=None, followersCount=None, friendsCount=None, statusesCount=None, favouritesCount=None, listedCount=None, mediaCount=None, location=None, protected=None, link=None, profileImageUrl=None, profileBannerUrl=None, label=None)]",156314492,fjartaza,"Periodista chileno, crítico, pero no criticón, gozador de la vida y de las buenas ideas.",2010-06-16 16:16:10+00:00,1247,Chile,False,1189691712186257411,Convencion_Constituyente_2019_Q4.csv,Convencion_Constituyente
1189911305504935936,2019-10-31 14:25:37+00:00,"@matiaswalkerp @carreragonzalo Y si antes ejercen facultades y sacan a todo aquel honorable del partido q sea x incitar al odio/destrucción d la nación. Creo q esa es la 1ra señal q deben dar, después hablemos d asamblea/convención constituyente. Hagan esa prueba d la blancura y tendrán votos para lo demás",0,0,1,0,es,,,"[User(username='matiaswalkerp', id=103259570, displayname='Matías Walker Prieto', rawDescription=None, renderedDescription=None, descriptionLinks=None, verified=None, created=None, followersCount=None, friendsCount=None, statusesCount=None, favouritesCount=None, listedCount=None, mediaCount=None, location=None, protected=None, link=None, profileImageUrl=None, profileBannerUrl=None, label=None), User(username='carreragonzalo', id=212552510, displayname='🎸 @carreragonzalo DIPUTADO 🎸', rawDescription=None, renderedDescription=None, descriptionLinks=None, verified=None, created=None, followersCount=None, friendsCount=None, statusesCount=None, favouritesCount=None, listedCount=None, mediaCount=None, location=None, protected=None, link=None, profileImageUrl=None, profileBannerUrl=None, label=None)]",2561667098,TheLoneWolf_67,Cansado de los que solo Rettwitean y no se mojan con sus opiniones. Cansado de los que dicen ser de gobierno pero solo se encargan de destruir a ese gobierno,2014-06-11 16:34:35+00:00,143,"Pueblo, Colorado, EE.UU.",False,1189669091046494209,Convencion_Constituyente_2019_Q4.csv,Convencion_Constituyente
1189906052223045632,2019-10-31 14:04:44+00:00,@yamilsantoro En el caso Ofelia lo definió la Convención Constituyente porteña,0,0,2,0,es,,,"[User(username='yamilsantoro', id=170431111, displayname='Yamil Santoro', rawDescription=None, renderedDescription=None, descriptionLinks=None, verified=None, created=None, followersCount=None, friendsCount=None, statusesCount=None, favouritesCount=None, listedCount=None, mediaCount=None, location=None, protected=None, link=None, profileImageUrl=None, profileBannerUrl=None, label=None)]",52962271,juvinformada,Juventud Informada | Conozco a uno que en 20 años va a ser Presidente de la Nación.,2009-07-02 03:59:42+00:00,5235,Afueras de Villa Crespo,False,1189905202800971776,Convencion_Constituyente_2019_Q4.csv,Convencion_Constituyente
1189878657944297473,2019-10-31 12:15:53+00:00,"@nemo_por @tv_monica @CNNChile @CHVNoticias Basta. Y una adicional respecto a la forma de hacerlo. AC, congreso, convención constituyente. Y luego, respetar la voluntad popular. Y si los que como Ud. están satisfechos con la situación actual vencen, perfecto. No hay que tener temor de la democracia. No necesita tutela.",0,0,0,0,es,,,"[User(username='nemo_por', id=1187749710792220673, displayname='NemoPorChile', rawDescription=None, renderedDescription=None, descriptionLinks=None, verified=None, created=None, followersCount=None, friendsCount=None, statusesCount=None, favouritesCount=None, listedCount=None, mediaCount=None, location=None, protected=None, link=None, profileImageUrl=None, profileBannerUrl=None, label=None), User(username='tv_monica', id=38002872, displayname='Mónica Rincón González', rawDescription=None, renderedDescription=None, descriptionLinks=None, verified=None, created=None, followersCount=None, friendsCount=None, statusesCount=None, favouritesCount=None, listedCount=None, mediaCount=None, location=None, protected=None, link=None, profileImageUrl=None, profileBannerUrl=None, label=None), User(username='CNNChile', id=18248645, displayname='CNN Chile', rawDescription=None, renderedDescription=None, descriptionLinks=None, verified=None, created=None, followersCount=None, friendsCount=None, statusesCount=None, favouritesCount=None, listedCount=None, mediaCount=None, location=None, protected=None, link=None, profileImageUrl=None, profileBannerUrl=None, label=None), User(username='CHVNoticias', id=51326671, displayname='CHV Noticias', rawDescription=None, renderedDescription=None, descriptionLinks=None, verified=None, created=None, followersCount=None, friendsCount=None, statusesCount=None, favouritesCount=None, listedCount=None, mediaCount=None, location=None, protected=None, link=None, profileImageUrl=None, profileBannerUrl=None, label=None)]",86176344,danrod1223,"Medico, curioso insobornable, con corazon azul, rockero, fanatico de la ciencia...ficción, viejo pero con espiritu joven, amante de mi familia.",2009-10-29 22:17:12+00:00,627,Puerto Montt,False,1189877896397180932,Convencion_Constituyente_2019_Q4.csv,Convencion_Constituyente
1189704591241289729,2019-10-31 00:44:12+00:00,"@fcoojeda Creo q es buena idea, puede ser AC o Convención constituyente, pero elegirlos junto con municipales y gore",0,0,0,0,es,"Place(id='01229a900036141c', fullName='Chimbarongo, Chile', name='Chimbarongo', type='city', country='Chile', countryCode='CL')",,"[User(username='fcoojeda', id=74239456, displayname='Francisco Ojeda', rawDescription=None, renderedDescription=None, descriptionLinks=None, verified=None, created=None, followersCount=None, friendsCount=None, statusesCount=None, favouritesCount=None, listedCount=None, mediaCount=None, location=None, protected=None, link=None, profileImageUrl=None, profileBannerUrl=None, label=None)]",13330432,prebolledoe,"Latinoamericano y latinoamericansta. De la bahía de Concepción. Militante de izquierda, por la democracia y el socialismo.",2008-02-11 01:56:26+00:00,7164,Chile,False,1189703271226716160,Convencion_Constituyente_2019_Q4.csv,Convencion_Constituyente
1189683403601395712,2019-10-30 23:20:01+00:00,"@Jaime_Bassa Podrías explicarme qué es exactamente la fórmula de convención o convención mixta? Asamblea constituyente o convención constituyente lo entendía como sinónimo, no como dos cosas distintas.  Igual la Constitución chilena las reconoce como diferentes pero no lo entiendo. Gracias!",0,0,0,0,es,,,"[User(username='Jaime_Bassa', id=338689270, displayname='Jaime Bassa', rawDescription=None, renderedDescription=None, descriptionLinks=None, verified=None, created=None, followersCount=None, friendsCount=None, statusesCount=None, favouritesCount=None, listedCount=None, mediaCount=None, location=None, protected=None, link=None, profileImageUrl=None, profileBannerUrl=None, label=None)]",2887304098,lujangimisabel,Universitat de València,2014-11-21 20:08:15+00:00,111,Valencia,False,1189640192031739904,Convencion_Constituyente_2019_Q4.csv,Convencion_Constituyente
1189669091046494209,2019-10-30 22:23:08+00:00,Y si en las elecciones de octubre de 2020 elegimos también a los delegados(as) a la Asamblea o Convención Constituyente? Voto 🗳,1410,844,472,285,es,,,,103259570,matiaswalkerp,Abogado. Senador de la República por la Región de Coquimbo. Presidente Comisión de Constitución del Senado. #DemócratasChile,2010-01-09 12:29:35+00:00,69954,,True,None,Convencion_Constituyente_2019_Q4.csv,Convencion_Constituyente
1189666797823418369,2019-10-30 22:14:02+00:00,"@Juanarivers Asamblea o Convención Constituyente, creo yo. Tiene que ser por abajo. Sería demasiado triste que todo esto no sirviera para nada.",1,0,0,0,es,,,"[User(username='Juanarivers', id=153934402, displayname='Juana Rivers', rawDescription=None, renderedDescription=None, descriptionLinks=None, verified=None, created=None, followersCount=None, friendsCount=None, statusesCount=None, favouritesCount=None, listedCount=None, mediaCount=None, location=None, protected=None, link=None, profileImageUrl=None, profileBannerUrl=None, label=None)]",52455061,turrientes,Siempre se me escapa algo.,2009-06-30 17:18:24+00:00,2627,"ñuñoa, santiago, chile",False,1189645995929489408,Convencion_Constituyente_2019_Q4.csv,Convencion_Constituyente
1189666322294214657,2019-10-30 22:12:08+00:00,"@Jaime_Bassa Creo que al Congreso hay que descartarlo. Son incumbentes.
Basta AC y Convención Constituyente, donde si pueden haber algunos parlamentarios.",0,0,0,0,es,,,"[User(username='Jaime_Bassa', id=338689270, displayname='Jaime Bassa', rawDescription=None, renderedDescription=None, descriptionLinks=None, verified=None, created=None, followersCount=None, friendsCount=None, statusesCount=None, favouritesCount=None, listedCount=None, mediaCount=None, location=None, protected=None, link=None, profileImageUrl=None, profileBannerUrl=None, label=None)]",1536890581,PatoRodrigoS,"Ingeniero Agronomo, MSc, Director Ejecutivo Corporación Chile Ambiente. Lucho por el Equilibrio Ecológico y una Ordenación Territorial Sustentable!!!",2013-06-21 16:31:35+00:00,640,Chile,False,1189640192031739904,Convencion_Constituyente_2019_Q4.csv,Convencion_Constituyente
1189626108683149313,2019-10-30 19:32:21+00:00,@MarianaContar Vilma Ibarra tuvo un rol muy relevante en la Convención Constituyente de 1994 en el Frente Grande. Una persona de altísimo valor político e intelectual. Lo digo porque trabajé ahí.,0,0,0,0,es,,,"[User(username='MarianaContar', id=142864300, displayname='Mariana Contartessi', rawDescription=None, renderedDescription=None, descriptionLinks=None, verified=None, created=None, followersCount=None, friendsCount=None, statusesCount=None, favouritesCount=None, listedCount=None, mediaCount=None, location=None, protected=None, link=None, profileImageUrl=None, profileBannerUrl=None, label=None)]",1044374927103717376,Lmas94230039,Amo a mi PATRIA,2018-09-24 23:56:00+00:00,7080,Argentina,False,None,Convencion_Constituyente_2019_Q4.csv,Convencion_Constituyente
1189585578117029888,2019-10-30 16:51:17+00:00,"El gob debiera poner toda la infraestructura q se estaba construyendo para la COP en Cerrillos, a disposición d distintos cabildos de la Región Metropolitana. Incluso en el futuro, a disposición de una Asamblea o Convención Constituyente. Chile se reconstruye a partir del diálogo",90,69,183,15,es,,,,76683098,senadorquintana,Papá y Senador por la Araucanía. Presidente comisión de Relaciones Exteriores @senado_chile.,2009-09-23 16:18:29+00:00,65728,Temuco,False,None,Convencion_Constituyente_2019_Q4.csv,Convencion_Constituyente
1189548409994338306,2019-10-30 14:23:36+00:00,"No será que el gobierno está ganando tiempo para:

Opción A) llamar a Plebiscito ciudadano para definir prioridades. 

Opción B) Alinearse por Asamblea o Convención Constituyente con la discusión en el Parlamento. 

Opción C) No se me ocurre otra.",0,0,0,0,es,,,,14905040,OrosNercelles,"Melómano, Maratonista, Trail Runner. Hablo con Gif. En otra vida sería escritor. Unión Española. Gallego. Sociólogo. Pop Soda Lover. #quevuelvanloslentos",2008-05-26 04:10:55+00:00,2057,,False,None,Convencion_Constituyente_2019_Q4.csv,Convencion_Constituyente
1189533549998813184,2019-10-30 13:24:33+00:00,".@desbordes: ""Yo no le tengo miedo a la democracia, ni a la ciudadanía. Y no tengo miedo que un futuro congreso constituyente o una convención constituyente o que al congreso que elijamos en un par de años más, le corresponda este rol. La gente decidirá en las urnas""",3,4,12,1,es,,,"[User(username='desbordes', id=45214422, displayname='Mario Desbordes Jiménez', rawDescription=None, renderedDescription=None, descriptionLinks=None, verified=None, created=None, followersCount=None, friendsCount=None, statusesCount=None, favouritesCount=None, listedCount=None, mediaCount=None, location=None, protected=None, link=None, profileImageUrl=None, profileBannerUrl=None, label=None)]",7769322,pablomatamoros,La nada nadea y el ser serea,2007-07-27 19:42:56+00:00,27087,"Santiago, Chile",False,None,Convencion_Constituyente_2019_Q4.csv,Convencion_Constituyente
1189302582612844546,2019-10-29 22:06:46+00:00,"@gvcontreras @AleDiezRT @micajfjv2018 @AXELKAISER Una asamblea o convención constituyente o constitucional es una reunión nacional de representantes populares que asumen el único objetivo acordar reglas, que en el futuro, regirán la relación entre gobernantes y gobernados, así como el funcionamiento, distribución del poder",1,0,2,0,es,,,"[User(username='gvcontreras', id=256586311, displayname='Patriota 😎#SoyDel62%', rawDescription=None, renderedDescription=None, descriptionLinks=None, verified=None, created=None, followersCount=None, friendsCount=None, statusesCount=None, favouritesCount=None, listedCount=None, mediaCount=None, location=None, protected=None, link=None, profileImageUrl=None, profileBannerUrl=None, label=None), User(username='micajfjv2018', id=1188961331216633857, displayname='micajfjv2018', rawDescription=None, renderedDescription=None, descriptionLinks=None, verified=None, created=None, followersCount=None, friendsCount=None, statusesCount=None, favouritesCount=None, listedCount=None, mediaCount=None, location=None, protected=None, link=None, profileImageUrl=None, profileBannerUrl=None, label=None), User(username='AXELKAISER', id=59815228, displayname='AXEL KAISER', rawDescription=None, renderedDescription=None, descriptionLinks=None, verified=None, created=None, followersCount=None, friendsCount=None, statusesCount=None, favouritesCount=None, listedCount=None, mediaCount=None, location=None, protected=None, link=None, profileImageUrl=None, profileBannerUrl=None, label=None)]",146962250,SebastiansOr,"Ciudadano crítico y activo del 38%..
Periodista.
Aca opiniones personales. 

Me gusta la fotografía y la agricultura.

El minero jamás retrocede⛏",2010-05-22 20:44:30+00:00,1211,"La Cisterna, Chile",False,1189211898807541765,Convencion_Constituyente_2019_Q4.csv,Convencion_Constituyente
