id,date,rawContent,replyCount,retweetCount,likeCount,quoteCount,lang,place,hashtags,mentionedUsers,user_id,user_name,user_renderedDescription,user_join_date,user_followers,user_location,user_verified,inReplyToTweetId,archivo,keyword
1189255330154323969,2019-10-29 18:59:00+00:00,"@matiaswalkerp @Senado_Chile @CamaraDiputados @felipeharboe @senadorquintana @ifloresdiputado @tomasjordanD @fernando_atria @Jaime_Bassa @yoshibellamy @DiputadosDC No me quedó claro si es asamblea o convención constituyente, ya que son demasiado distintas.",0,0,0,0,es,,,"[User(username='matiaswalkerp', id=103259570, displayname='Matías Walker Prieto', rawDescription=None, renderedDescription=None, descriptionLinks=None, verified=None, created=None, followersCount=None, friendsCount=None, statusesCount=None, favouritesCount=None, listedCount=None, mediaCount=None, location=None, protected=None, link=None, profileImageUrl=None, profileBannerUrl=None, label=None), User(username='Senado_Chile', id=418660662, displayname='Senado Chile', rawDescription=None, renderedDescription=None, descriptionLinks=None, verified=None, created=None, followersCount=None, friendsCount=None, statusesCount=None, favouritesCount=None, listedCount=None, mediaCount=None, location=None, protected=None, link=None, profileImageUrl=None, profileBannerUrl=None, label=None), User(username='CamaraDiputados', id=1451611008456343553, displayname='camara diputados', rawDescription=None, renderedDescription=None, descriptionLinks=None, verified=None, created=None, followersCount=None, friendsCount=None, statusesCount=None, favouritesCount=None, listedCount=None, mediaCount=None, location=None, protected=None, link=None, profileImageUrl=None, profileBannerUrl=None, label=None), User(username='felipeharboe', id=19294551, displayname='Felipe Harboe B', rawDescription=None, renderedDescription=None, descriptionLinks=None, verified=None, created=None, followersCount=None, friendsCount=None, statusesCount=None, favouritesCount=None, listedCount=None, mediaCount=None, location=None, protected=None, link=None, profileImageUrl=None, profileBannerUrl=None, label=None), User(username='senadorquintana', id=76683098, displayname='Jaime Quintana', rawDescription=None, renderedDescription=None, descriptionLinks=None, verified=None, created=None, followersCount=None, friendsCount=None, statusesCount=None, favouritesCount=None, listedCount=None, mediaCount=None, location=None, protected=None, link=None, profileImageUrl=None, profileBannerUrl=None, label=None), User(username='tomasjordanD', id=440762151, displayname='Tomás Jordán D.', rawDescription=None, renderedDescription=None, descriptionLinks=None, verified=None, created=None, followersCount=None, friendsCount=None, statusesCount=None, favouritesCount=None, listedCount=None, mediaCount=None, location=None, protected=None, link=None, profileImageUrl=None, profileBannerUrl=None, label=None), User(username='fernando_atria', id=2764352584, displayname='Fernando Atria.', rawDescription=None, renderedDescription=None, descriptionLinks=None, verified=None, created=None, followersCount=None, friendsCount=None, statusesCount=None, favouritesCount=None, listedCount=None, mediaCount=None, location=None, protected=None, link=None, profileImageUrl=None, profileBannerUrl=None, label=None), User(username='Jaime_Bassa', id=338689270, displayname='Jaime Bassa', rawDescription=None, renderedDescription=None, descriptionLinks=None, verified=None, created=None, followersCount=None, friendsCount=None, statusesCount=None, favouritesCount=None, listedCount=None, mediaCount=None, location=None, protected=None, link=None, profileImageUrl=None, profileBannerUrl=None, label=None), User(username='yoshibellamy', id=280594750, displayname='J. Ignacio Núñez', rawDescription=None, renderedDescription=None, descriptionLinks=None, verified=None, created=None, followersCount=None, friendsCount=None, statusesCount=None, favouritesCount=None, listedCount=None, mediaCount=None, location=None, protected=None, link=None, profileImageUrl=None, profileBannerUrl=None, label=None), User(username='DiputadosDC', id=150737392, displayname='Bancada DC', rawDescription=None, renderedDescription=None, descriptionLinks=None, verified=None, created=None, followersCount=None, friendsCount=None, statusesCount=None, favouritesCount=None, listedCount=None, mediaCount=None, location=None, protected=None, link=None, profileImageUrl=None, profileBannerUrl=None, label=None)]",1092286146187538432,TitoVox,"🇨🇱 Patriota, liberal, abogado",2019-02-04 04:58:05+00:00,193,Chile,False,1189226993029648384,Convencion_Constituyente_2019_Q4.csv,Convencion_Constituyente
1189226993029648384,2019-10-29 17:06:24+00:00,Ya tenemos un #ProcesoConstituyenteEnMarcha. Excelente reunión con presidentes de @Senado_Chile y @CamaraDiputados y senador @felipeharboe. En noviembre nos comprometimos a despachar de la Cámara reforma constitucional para una Asamblea (o Convención) Constituyente y plebiscito. https://t.co/AiU1UWom4B,145,68,122,30,es,,['ProcesoConstituyenteEnMarcha'],"[User(username='Senado_Chile', id=418660662, displayname='Senado Chile', rawDescription=None, renderedDescription=None, descriptionLinks=None, verified=None, created=None, followersCount=None, friendsCount=None, statusesCount=None, favouritesCount=None, listedCount=None, mediaCount=None, location=None, protected=None, link=None, profileImageUrl=None, profileBannerUrl=None, label=None), User(username='CamaraDiputados', id=1451611008456343553, displayname='camara diputados', rawDescription=None, renderedDescription=None, descriptionLinks=None, verified=None, created=None, followersCount=None, friendsCount=None, statusesCount=None, favouritesCount=None, listedCount=None, mediaCount=None, location=None, protected=None, link=None, profileImageUrl=None, profileBannerUrl=None, label=None), User(username='felipeharboe', id=19294551, displayname='Felipe Harboe B', rawDescription=None, renderedDescription=None, descriptionLinks=None, verified=None, created=None, followersCount=None, friendsCount=None, statusesCount=None, favouritesCount=None, listedCount=None, mediaCount=None, location=None, protected=None, link=None, profileImageUrl=None, profileBannerUrl=None, label=None)]",103259570,matiaswalkerp,Abogado. Senador de la República por la Región de Coquimbo. Presidente Comisión de Constitución del Senado. #DemócratasChile,2010-01-09 12:29:35+00:00,69954,,True,None,Convencion_Constituyente_2019_Q4.csv,Convencion_Constituyente
1189178941933682690,2019-10-29 13:55:28+00:00,"@caguileracortez @Patricioalle @Carolabototo @PANCHOSAAVEDRA La AC considera la participación ciudadana para redactar la constitución, a diferencia de la actual que fue escrita por políticos y militares entre 4 paredes. De lo que tú hablas es d una convención constituyente que es redactada por el  legislativo sin participación ciudadana.",3,0,5,0,es,,,"[User(username='caguileracortez', id=557946020, displayname='Carlos Aguilera', rawDescription=None, renderedDescription=None, descriptionLinks=None, verified=None, created=None, followersCount=None, friendsCount=None, statusesCount=None, favouritesCount=None, listedCount=None, mediaCount=None, location=None, protected=None, link=None, profileImageUrl=None, profileBannerUrl=None, label=None), User(username='Patricioalle', id=3676303635, displayname='Patricio Allendes Matus', rawDescription=None, renderedDescription=None, descriptionLinks=None, verified=None, created=None, followersCount=None, friendsCount=None, statusesCount=None, favouritesCount=None, listedCount=None, mediaCount=None, location=None, protected=None, link=None, profileImageUrl=None, profileBannerUrl=None, label=None), User(username='Carolabototo', id=999838680, displayname='Caro india María', rawDescription=None, renderedDescription=None, descriptionLinks=None, verified=None, created=None, followersCount=None, friendsCount=None, statusesCount=None, favouritesCount=None, listedCount=None, mediaCount=None, location=None, protected=None, link=None, profileImageUrl=None, profileBannerUrl=None, label=None), User(username='panchosaavedra', id=1521485567183278083, displayname='FRANCISCO EDUARDO SAAVEDRA RETAMAL', rawDescription=None, renderedDescription=None, descriptionLinks=None, verified=None, created=None, followersCount=None, friendsCount=None, statusesCount=None, favouritesCount=None, listedCount=None, mediaCount=None, location=None, protected=None, link=None, profileImageUrl=None, profileBannerUrl=None, label=None)]",121277378,veronicacivil,APRUEBO+CONVENCIÓN CONSTITUCIONAL,2010-03-09 00:49:18+00:00,341,Concepción ,False,1189173966189027338,Convencion_Constituyente_2019_Q4.csv,Convencion_Constituyente
1189161177714171904,2019-10-29 12:44:52+00:00,"@freakyfly_ Finalmente, se presentó un proyecto  que justamente habilitaba al actual congreso para conformar una convención constituyente vía LOC. Ningún parlamentario de Chile Vamos votó a favor en la comisión respectiva, tampoco.",0,3,4,0,es,,,"[User(username='freakyfly_', id=21816621, displayname='𝓟𝓲𝓽𝓮𝓻 🔰', rawDescription=None, renderedDescription=None, descriptionLinks=None, verified=None, created=None, followersCount=None, friendsCount=None, statusesCount=None, favouritesCount=None, listedCount=None, mediaCount=None, location=None, protected=None, link=None, profileImageUrl=None, profileBannerUrl=None, label=None)]",255160670,Don_BC,Lo importante es compartir y hacer amigos.,2011-02-20 20:12:35+00:00,6727,,False,1189160166412959745,Convencion_Constituyente_2019_Q4.csv,Convencion_Constituyente
1189153308507869184,2019-10-29 12:13:36+00:00,@ignaciowalker Hola ignacio. En mi humilde opinión el único acuerdo político posible es que todos los partidos empujen en el Congreso un proyecto de ley que permita hacer una asamblea o convención constituyente. Ya no hay espacio para arreglines cupulares. Hay que dar participación real,0,3,2,0,es,,,"[User(username='ignaciowalker', id=62530556, displayname='Ignacio Walker', rawDescription=None, renderedDescription=None, descriptionLinks=None, verified=None, created=None, followersCount=None, friendsCount=None, statusesCount=None, favouritesCount=None, listedCount=None, mediaCount=None, location=None, protected=None, link=None, profileImageUrl=None, profileBannerUrl=None, label=None)]",156314492,fjartaza,"Periodista chileno, crítico, pero no criticón, gozador de la vida y de las buenas ideas.",2010-06-16 16:16:10+00:00,1247,Chile,False,1188981865069338624,Convencion_Constituyente_2019_Q4.csv,Convencion_Constituyente
1188999354021040128,2019-10-29 02:01:51+00:00,Propongo una convención constituyente para eliminar el concepto de primera dama y así dejar de discutir pelotudeces denigrantes.,1,4,35,1,es,,,,168350608,JeanIrisMurdoch,Sin solución de continuidad.,2010-07-19 03:06:44+00:00,623,,False,None,Convencion_Constituyente_2019_Q4.csv,Convencion_Constituyente
1188929643916738560,2019-10-28 21:24:51+00:00,"@pepeolaveid No, pq el plebiscito es justo para eso. 1º, para q la ciudadanía diga si quiere o no una #NuevaConstitución (me da la impresión que sí). 2º, según las opciones que incluye nuestro proyecto, si quiere #AsambleaConstituyente o una “Convención Constituyente”. Mi opción es #AC",2,3,4,0,es,,"['NuevaConstitución', 'AsambleaConstituyente', 'AC']",,847488627303038976,senadorLatorre,"Papá, Senador por la Región de Valparaíso, presidente de @RDemocratica y frenteamplista. Estoy en Comisión d Medio Ambiente, Recursos Hídricos y Zonas Extremas.",2017-03-30 16:40:09+00:00,35609,"Valparaíso, Chile",False,1188924892512686080,Convencion_Constituyente_2019_Q4.csv,Convencion_Constituyente
1188928180050190336,2019-10-28 21:19:01+00:00,"https://t.co/E127P4T4rD
Premio Mujer del año Fundación COAS 1998
Por su labor en la Convención Constituyente de 1994 Medalla de Oro de la Coordinadora de Cajas de Previsión y Seguridad Social para Profesionales de Argentina 1994
(DISTINCIONES)",0,0,0,0,es,,,,941007929473368064,Nildarosasnche1,Interesada en la realidad sociopolítica de Argentina y firme en sus convicciones.,2017-12-13 18:12:28+00:00,122,Salliqueló-Provincia Bs As,False,None,Convencion_Constituyente_2019_Q4.csv,Convencion_Constituyente
1188887957601771522,2019-10-28 18:39:12+00:00,"la soberanía cuyo ejercicio delega conforme a:
Asambleas constituyentes 
Comisión bicameral 
Convención constituyente mixta y plebiscito.
las nuevas reforma que a tenido la actual constitución y los nuevos proyectos de ley que deben modificarla. #ChileDespierta #YoApoyo",0,0,0,0,es,,"['ChileDespierta', 'YoApoyo']",,1183462995818627075,wengamenods,Transformamos pequeñas cosas en grandes sueños,2019-10-13 19:23:38+00:00,0,,False,None,Convencion_Constituyente_2019_Q4.csv,Convencion_Constituyente
1188666566826713088,2019-10-28 03:59:28+00:00,"@clarieO7 @ckreutzer67 @verosselot Para reformar y desarmar la CN se necesita una convención constituyente.
No repitas pavadas.",1,0,0,0,es,,,"[User(username='ckreutzer67', id=876079838012084225, displayname='Christián Kreutzer', rawDescription=None, renderedDescription=None, descriptionLinks=None, verified=None, created=None, followersCount=None, friendsCount=None, statusesCount=None, favouritesCount=None, listedCount=None, mediaCount=None, location=None, protected=None, link=None, profileImageUrl=None, profileBannerUrl=None, label=None), User(username='verosselot', id=803774956920336384, displayname='Verosselot 😻', rawDescription=None, renderedDescription=None, descriptionLinks=None, verified=None, created=None, followersCount=None, friendsCount=None, statusesCount=None, favouritesCount=None, listedCount=None, mediaCount=None, location=None, protected=None, link=None, profileImageUrl=None, profileBannerUrl=None, label=None)]",2687886512,zombideferro,"Three little birds + G. 3 de-generaciones de Ferro. Filosofía. Viajar. Algo de medicina. Guarda que viene el centro.  
Tá fuil glas.
Shaken, not stirred.",2014-07-28 16:37:28+00:00,973,Flores,False,1188615816507510784,Convencion_Constituyente_2019_Q4.csv,Convencion_Constituyente
1188548221456531457,2019-10-27 20:09:12+00:00,@sebastianpinera Sr presidente no escucho como Macri. UD. Tiene que irse llamando a elecciones y una convención constituyente que trate la reforma constituciinal. No mire para otro lado q se le quemara el rancho. Salga honrosamente y haga historia.,0,0,0,0,es,,,"[User(username='sebastianpinera', id=13623532, displayname='Sebastian Piñera', rawDescription=None, renderedDescription=None, descriptionLinks=None, verified=None, created=None, followersCount=None, friendsCount=None, statusesCount=None, favouritesCount=None, listedCount=None, mediaCount=None, location=None, protected=None, link=None, profileImageUrl=None, profileBannerUrl=None, label=None)]",810209118,luisoscarperez2,,2012-09-08 04:57:37+00:00,6,,False,1188146289168539649,Convencion_Constituyente_2019_Q4.csv,Convencion_Constituyente
1188530110992998403,2019-10-27 18:57:14+00:00,"Asamblea Constituyente. “Una asamblea o convención constituyente o constitucional es una reunión nacional de representantes populares que asumen el único objetivo acordar reglas, que en el futuro, regirán la relación entre gobernantes y gobernados, así como el funcionamiento...",1,1,1,0,es,,,,103883792,Clamarc2010,Ok,2010-01-11 15:29:51+00:00,8,,False,None,Convencion_Constituyente_2019_Q4.csv,Convencion_Constituyente
1188512629645627392,2019-10-27 17:47:47+00:00,"@raulmelamed 1870, preparativos de la Convención Constituyente, se organizaron dos nucleaciones políticas, denominadas respectivamente “Club del Pueblo” y “Gran Club del Pueblo”. El primero postulaba la candidatura presidencial del coronel Fernando Iturburu, jefe de la “Legión Paraguaya”,",1,0,0,0,es,,,"[User(username='raulmelamed', id=398885521, displayname='Raúl Melamed 🇷🇺', rawDescription=None, renderedDescription=None, descriptionLinks=None, verified=None, created=None, followersCount=None, friendsCount=None, statusesCount=None, favouritesCount=None, listedCount=None, mediaCount=None, location=None, protected=None, link=None, profileImageUrl=None, profileBannerUrl=None, label=None)]",161287315,lugo_ch,Arquitecto de Profesión -Propietario @Volare_viajespy Agencia de Viajes-Propietario de @Cerveroga “Cervezas Artesanales Nacionales”,2010-06-30 13:20:15+00:00,407,Asunción ,False,1188505309758791681,Convencion_Constituyente_2019_Q4.csv,Convencion_Constituyente
1188486581189009409,2019-10-27 16:04:16+00:00,"C).-Electa la Convención Constituyente esta tendrá 60 días para debatir y aprobar una nueva Constitución, que será llevada a referéndum para legitimarla,por la ciudadanía
EL PCO no demoraría más de 9 meses en total.",0,12,16,0,es,,,,315963466,MiguelABernalV,"Catedrático de Derecho constitucional. Ciudadano Activista de los Derechos Humanos,",2011-06-12 18:41:03+00:00,154711,Panamá,False,None,Convencion_Constituyente_2019_Q4.csv,Convencion_Constituyente
1188485944967663620,2019-10-27 16:01:44+00:00,"B) El PCO debe llevar a un Pacto por Panamá (PPP) para la convocatoria de la elección de una Convención Constituyente. Previamente se establecerán las modalidades de participación, elección y propuestas de los constituyentes en un número no mayor de 45",2,8,9,0,es,,,,315963466,MiguelABernalV,"Catedrático de Derecho constitucional. Ciudadano Activista de los Derechos Humanos,",2011-06-12 18:41:03+00:00,154711,Panamá,False,None,Convencion_Constituyente_2019_Q4.csv,Convencion_Constituyente
1188457606567862275,2019-10-27 14:09:08+00:00,"@BsAs_recuerdo @lilianafranco20 En los que el Peronismo, proscripto, votó en blanco. Por supuesto, el voto en blanco fue mayoritario. Con esa ""legitimidad"" se reunió la Convención Constituyente que avaló la derogación por decreto de la Constitución Nacional de 1949 e introdujo, como justificativo, el art. 14bis",0,0,4,0,es,,,"[User(username='BsAs_recuerdo', id=858357868084461570, displayname='Buenos Aires en el recuerdo', rawDescription=None, renderedDescription=None, descriptionLinks=None, verified=None, created=None, followersCount=None, friendsCount=None, statusesCount=None, favouritesCount=None, listedCount=None, mediaCount=None, location=None, protected=None, link=None, profileImageUrl=None, profileBannerUrl=None, label=None), User(username='lilianafranco20', id=160271681, displayname='Liliana Franco', rawDescription=None, renderedDescription=None, descriptionLinks=None, verified=None, created=None, followersCount=None, friendsCount=None, statusesCount=None, favouritesCount=None, listedCount=None, mediaCount=None, location=None, protected=None, link=None, profileImageUrl=None, profileBannerUrl=None, label=None)]",3797006243,ejvior_,,2015-09-27 21:49:58+00:00,1373,"Buenos Aires, Argentina",False,1188453399869689857,Convencion_Constituyente_2019_Q4.csv,Convencion_Constituyente
1188161353011343360,2019-10-26 18:31:56+00:00,"@sebastianpinera Usted es responsable del asesinato de muchos ciudadanos, lo correcto es renunciar y esperar con serenidad que se haga justicia.

Lo mejor que le podría pasar al Pueblo Chileno es convocar a una Convención Constituyente que acabara definitivamente con la que dejó Pinochet.",0,0,0,0,es,,,"[User(username='sebastianpinera', id=13623532, displayname='Sebastian Piñera', rawDescription=None, renderedDescription=None, descriptionLinks=None, verified=None, created=None, followersCount=None, friendsCount=None, statusesCount=None, favouritesCount=None, listedCount=None, mediaCount=None, location=None, protected=None, link=None, profileImageUrl=None, profileBannerUrl=None, label=None)]",276217710,marloscaida,"Me cuesta mucho escribir sobre mi.... prefiero hacerlo sobre una mesa.

SPN",2011-04-02 22:26:43+00:00,708,"Ushuaia, Argentina",False,1187887888069025794,Convencion_Constituyente_2019_Q4.csv,Convencion_Constituyente
1188137552500477957,2019-10-26 16:57:21+00:00,"🗳️Fernando Lugo señaló que el llamado a una convención constituyente para reformar la Constitución podría darse luego de las elecciones municipales 2020.

https://t.co/LkMsOdLV9L",0,3,4,1,es,,,,28191953,ABCDigital,"ABC Digital, el diario digital con mayor cantidad de visitas del Paraguay. 

Telegram: t.me/ABCDigitalPY 
Whatsapp: chat.whatsapp.com/FGsmeRyXU2UGVb…",2009-04-01 20:49:43+00:00,1280485,"Asunción, Paraguay",True,None,Convencion_Constituyente_2019_Q4.csv,Convencion_Constituyente
1187735252195774465,2019-10-25 14:18:45+00:00,@cbellolio Resucitemos el proyecto moderado que dejó Bachelet. Con esfuerzo logramos que se apruebe desde derecha del FA hasta izquierda de la UDI. Este parlamento elegido sin binominal se convertiría en Convención Constituyente,1,0,0,0,es,,,"[User(username='cbellolio', id=76080332, displayname='Cristóbal Bellolio', rawDescription=None, renderedDescription=None, descriptionLinks=None, verified=None, created=None, followersCount=None, friendsCount=None, statusesCount=None, favouritesCount=None, listedCount=None, mediaCount=None, location=None, protected=None, link=None, profileImageUrl=None, profileBannerUrl=None, label=None)]",68103613,Carlos1776_,,2009-08-23 08:17:14+00:00,1300,Santiago,False,1187728085480824835,Convencion_Constituyente_2019_Q4.csv,Convencion_Constituyente
1187729843733045248,2019-10-25 13:57:16+00:00,"Una de las cosas más brillantes de su voto fue citar las distintas redacciones propuestas para el Art. 5 inc. LVII de la Constitución durante la convención constituyente de 1988, así como sus redacciones anteriores. Ese recorrido muestra claramente la voluntad del constituyente.",1,0,4,0,es,,,,57877976,bbimbi,"Periodista, doctor en Estudios del Lenguaje (PUC-Rio) y autor de los libros “Matrimonio igualitario” y “El fin del armario” (link abajo). #JeSuisCharlie",2009-07-18 07:05:25+00:00,66872,"Madrid, Comunidad de Madrid",True,1187728730971611136,Convencion_Constituyente_2019_Q4.csv,Convencion_Constituyente
1187542337674797058,2019-10-25 01:32:11+00:00,"@javiarce AC: Una asamblea o convención constituyente o constitucional es una reunión nacional de representantes populares.

Por curiosidad, ¿por qué mecanismo se eligirían esos representantes?",0,0,0,0,es,,,"[User(username='javiarce', id=39056168, displayname='Javiera Arce', rawDescription=None, renderedDescription=None, descriptionLinks=None, verified=None, created=None, followersCount=None, friendsCount=None, statusesCount=None, favouritesCount=None, listedCount=None, mediaCount=None, location=None, protected=None, link=None, profileImageUrl=None, profileBannerUrl=None, label=None)]",2542332571,edustekel,,2014-06-02 22:41:13+00:00,447,,False,1187098459310100481,Convencion_Constituyente_2019_Q4.csv,Convencion_Constituyente
1187298491137216512,2019-10-24 09:23:13+00:00,"""No se si es el momento de una convención constituyente, se necesita un gran acuerdo nacional"" Dr. Eduardo González, Apoderado del Movimiento Honor Colorado #Enfoque800",0,0,0,0,es,,['Enfoque800'],,1457224374,LaUnionAM,"Información y buena música nacional
📻 800 AM
📻 Ciudad del Este (5 a 15hs) 95.7 FM
📻 Caaguazu (5 a 15hs) 104.1 FM",2013-05-25 15:11:10+00:00,115637,,False,None,Convencion_Constituyente_2019_Q4.csv,Convencion_Constituyente
1187294542237708288,2019-10-24 09:07:32+00:00,"""Vamos a impulsar una Convención Constituyente desde el Consejo de Seccionales"" Edgar López, Presidente del Consejo de Seccionales Coloradas #Enfoque800",3,0,0,0,es,,['Enfoque800'],,1457224374,LaUnionAM,"Información y buena música nacional
📻 800 AM
📻 Ciudad del Este (5 a 15hs) 95.7 FM
📻 Caaguazu (5 a 15hs) 104.1 FM",2013-05-25 15:11:10+00:00,115637,,False,None,Convencion_Constituyente_2019_Q4.csv,Convencion_Constituyente
1187132357599514624,2019-10-23 22:23:04+00:00,"Plantear una convención constituyente, con todo el costo que implica (elecciones, sueldos, cargos, gastos de oficina, etc.), sin agenda ni proyectos, y solo para favorecer las ambiciones de #Cartes, es un insulto a la gente, y un acto de irresponsabilidad.",4,20,47,0,es,,['Cartes'],,329232048,FilizzolaRafael,"Abogado, docente universitario y, más importante de todo, papá de Mau y Cori.",2011-07-04 18:52:57+00:00,34216,"Asuncion, Paraguay",False,None,Convencion_Constituyente_2019_Q4.csv,Convencion_Constituyente
