id,date,rawContent,replyCount,retweetCount,likeCount,quoteCount,lang,place,hashtags,mentionedUsers,user_id,user_name,user_renderedDescription,user_join_date,user_followers,user_location,user_verified,inReplyToTweetId,archivo,keyword
1179884434067263491,2019-10-03 22:22:24+00:00,@OSammartino @walter_villalba Una convencion constituyente al menos surge de una eleccion,0,0,0,0,es,,,"[User(username='OSammartino', id=339254354, displayname='O. Pérez Sammartino', rawDescription=None, renderedDescription=None, descriptionLinks=None, verified=None, created=None, followersCount=None, friendsCount=None, statusesCount=None, favouritesCount=None, listedCount=None, mediaCount=None, location=None, protected=None, link=None, profileImageUrl=None, profileBannerUrl=None, label=None), User(username='walter_villalba', id=130509757, displayname='Walter Villalba 🍀🧉', rawDescription=None, renderedDescription=None, descriptionLinks=None, verified=None, created=None, followersCount=None, friendsCount=None, statusesCount=None, favouritesCount=None, listedCount=None, mediaCount=None, location=None, protected=None, link=None, profileImageUrl=None, profileBannerUrl=None, label=None)]",561430205,1252336,,2012-04-23 20:07:55+00:00,56,,False,1179869142276608001,Convencion_Constituyente_2019_Q4.csv,Convencion_Constituyente
1179869142276608001,2019-10-03 21:21:39+00:00,@walter_villalba Woodrow Wilson dijo que la Corte Suprema es una Convención Constituyente en sesión permanente. Estos lo tomaron al pie de la letra.,3,3,11,0,es,,,"[User(username='walter_villalba', id=130509757, displayname='Walter Villalba 🍀🧉', rawDescription=None, renderedDescription=None, descriptionLinks=None, verified=None, created=None, followersCount=None, friendsCount=None, statusesCount=None, favouritesCount=None, listedCount=None, mediaCount=None, location=None, protected=None, link=None, profileImageUrl=None, profileBannerUrl=None, label=None)]",339254354,OSammartino,Hace más de medio siglo que soy una gran promesa.,2011-07-20 20:31:58+00:00,16428,Buenos Aires,False,1179867019832893441,Convencion_Constituyente_2019_Q4.csv,Convencion_Constituyente
1179628340761808896,2019-10-03 05:24:47+00:00,"@MMeragelman @Nelsondefierro @laredlarioja1 Durante la gestión al frente del Municipio Capitalino del actual Dip. Pcial Ricardo Quintela, se intentó el llamado a una nueva Convención Constituyente Municipal pero, desde la Función Ejecutiva el déspota, hoy Intendente de éste Dpto Paredes Urquiza, se encargó de impedirlo.",0,0,1,0,es,,,"[User(username='MMeragelman', id=1038131900, displayname='Mattias Meragelman', rawDescription=None, renderedDescription=None, descriptionLinks=None, verified=None, created=None, followersCount=None, friendsCount=None, statusesCount=None, favouritesCount=None, listedCount=None, mediaCount=None, location=None, protected=None, link=None, profileImageUrl=None, profileBannerUrl=None, label=None), User(username='Nelsondefierro', id=874124466, displayname='Nelson Johannesen', rawDescription=None, renderedDescription=None, descriptionLinks=None, verified=None, created=None, followersCount=None, friendsCount=None, statusesCount=None, favouritesCount=None, listedCount=None, mediaCount=None, location=None, protected=None, link=None, profileImageUrl=None, profileBannerUrl=None, label=None), User(username='laredlarioja1', id=814179217, displayname='La Red La Rioja 88.3', rawDescription=None, renderedDescription=None, descriptionLinks=None, verified=None, created=None, followersCount=None, friendsCount=None, statusesCount=None, favouritesCount=None, listedCount=None, mediaCount=None, location=None, protected=None, link=None, profileImageUrl=None, profileBannerUrl=None, label=None)]",1528951729,lilianagaset,"Madre de Juan y Facundo, Licenciada en Administración de Empresas, Profesora de Música, Amante de la Naturaleza y los Animales. Peronista e hincha de River.",2013-06-18 21:47:21+00:00,312,,False,1179542564069883904,Convencion_Constituyente_2019_Q4.csv,Convencion_Constituyente
1179622743907688448,2019-10-03 05:02:33+00:00,"@MMeragelman @Nelsondefierro @laredlarioja1 La Convención Constituyente Municipal del 87, que tuve el honor de integrar y actuar como Secretaria, dio como resultado, en el caso del Dpto capital, una Carta Orgánica Municipal, que fue tomada como modelo por otras ciudades del País. Lamentable fueron derogadas hace 19 años.",0,0,3,0,es,,,"[User(username='MMeragelman', id=1038131900, displayname='Mattias Meragelman', rawDescription=None, renderedDescription=None, descriptionLinks=None, verified=None, created=None, followersCount=None, friendsCount=None, statusesCount=None, favouritesCount=None, listedCount=None, mediaCount=None, location=None, protected=None, link=None, profileImageUrl=None, profileBannerUrl=None, label=None), User(username='Nelsondefierro', id=874124466, displayname='Nelson Johannesen', rawDescription=None, renderedDescription=None, descriptionLinks=None, verified=None, created=None, followersCount=None, friendsCount=None, statusesCount=None, favouritesCount=None, listedCount=None, mediaCount=None, location=None, protected=None, link=None, profileImageUrl=None, profileBannerUrl=None, label=None), User(username='laredlarioja1', id=814179217, displayname='La Red La Rioja 88.3', rawDescription=None, renderedDescription=None, descriptionLinks=None, verified=None, created=None, followersCount=None, friendsCount=None, statusesCount=None, favouritesCount=None, listedCount=None, mediaCount=None, location=None, protected=None, link=None, profileImageUrl=None, profileBannerUrl=None, label=None)]",1528951729,lilianagaset,"Madre de Juan y Facundo, Licenciada en Administración de Empresas, Profesora de Música, Amante de la Naturaleza y los Animales. Peronista e hincha de River.",2013-06-18 21:47:21+00:00,312,,False,1179542564069883904,Convencion_Constituyente_2019_Q4.csv,Convencion_Constituyente
1179580964755951616,2019-10-03 02:16:32+00:00,"@pau_tw1 @GustavoBarbaro @mickyy_vainilla @AcademiaAny @alferdez El 14 bis de la Constitución de Aramburu . De lo peor que se ha echo en este país. Y encima ilegal , porque se llamó a Constituyentes con el Congreso cerrado. Y solo se puede llamar a Convención Constituyente con el acuerdo de los 2/3 del Congreso",0,0,2,0,es,,,"[User(username='GustavoBarbaro', id=38158044, displayname='Gustavo Barbaro', rawDescription=None, renderedDescription=None, descriptionLinks=None, verified=None, created=None, followersCount=None, friendsCount=None, statusesCount=None, favouritesCount=None, listedCount=None, mediaCount=None, location=None, protected=None, link=None, profileImageUrl=None, profileBannerUrl=None, label=None), User(username='mickyy_vainilla', id=1133443615374680065, displayname='EvaLilita🐱🌈🌱', rawDescription=None, renderedDescription=None, descriptionLinks=None, verified=None, created=None, followersCount=None, friendsCount=None, statusesCount=None, favouritesCount=None, listedCount=None, mediaCount=None, location=None, protected=None, link=None, profileImageUrl=None, profileBannerUrl=None, label=None), User(username='AcademiaAny', id=1075473783706828801, displayname='@any_academia😺 mucho más que el 41%', rawDescription=None, renderedDescription=None, descriptionLinks=None, verified=None, created=None, followersCount=None, friendsCount=None, statusesCount=None, favouritesCount=None, listedCount=None, mediaCount=None, location=None, protected=None, link=None, profileImageUrl=None, profileBannerUrl=None, label=None), User(username='alferdez', id=149991703, displayname='Alberto Fernández', rawDescription=None, renderedDescription=None, descriptionLinks=None, verified=None, created=None, followersCount=None, friendsCount=None, statusesCount=None, favouritesCount=None, listedCount=None, mediaCount=None, location=None, protected=None, link=None, profileImageUrl=None, profileBannerUrl=None, label=None)]",3290312016,mario_olea1,". Tuiter me cerró@marioolea1. Ahora, acá. Antik. Freudiano y Darwiniano. Me esfuerzo para que los k se vayan y no vuelvan jamás.Seguirán. No pongo coranzoncitos",2015-07-24 16:22:14+00:00,2933,,False,1179580285563879425,Convencion_Constituyente_2019_Q4.csv,Convencion_Constituyente
1179540044538929152,2019-10-02 23:33:56+00:00,"El caradura de Arcando, sin estudio alguno en Derecho, recordando su paso ""como integrante"" de la Convención Constituyente de 1994. Si, era el chofer y plancha camisas de Manfredotti. Cualquier falsedad para decir en su desesperación por ser senador. https://t.co/dVtngB2tU7 https://t.co/rNpOvl6ReD",0,0,0,0,es,,,,701778123193499648,DrFRauch,"Abogado constitucionalista. Fueguino y coprotagonista de su Historia. Director de Rauch, Aciar &  Cia. ""El precio de la libertad es su eterna vigilancia""",2016-02-22 14:38:37+00:00,602,Ushuaia,False,None,Convencion_Constituyente_2019_Q4.csv,Convencion_Constituyente
1179418151630643200,2019-10-02 15:29:34+00:00,@dinarezi @mauriciomacri @gabimraida @gustavohein_ Por qué sería histórico? sólo por tener una confesión religiosa? Néstor Míguez estuvo en la Convención Constituyente del 94 y no vimos que ande proclamándolo con bombos y platillos.,1,0,19,0,es,"Place(id='00f84d414936f28e', fullName='Córdoba, Argentina', name='Córdoba', type='city', country='Argentina', countryCode='AR')",,"[User(username='dinarezi', id=231239794, displayname='Dina Rezinovsky', rawDescription=None, renderedDescription=None, descriptionLinks=None, verified=None, created=None, followersCount=None, friendsCount=None, statusesCount=None, favouritesCount=None, listedCount=None, mediaCount=None, location=None, protected=None, link=None, profileImageUrl=None, profileBannerUrl=None, label=None), User(username='mauriciomacri', id=24900072, displayname='Mauricio Macri', rawDescription=None, renderedDescription=None, descriptionLinks=None, verified=None, created=None, followersCount=None, friendsCount=None, statusesCount=None, favouritesCount=None, listedCount=None, mediaCount=None, location=None, protected=None, link=None, profileImageUrl=None, profileBannerUrl=None, label=None), User(username='gabimraida', id=334700343, displayname='Gabriel Mraida', rawDescription=None, renderedDescription=None, descriptionLinks=None, verified=None, created=None, followersCount=None, friendsCount=None, statusesCount=None, favouritesCount=None, listedCount=None, mediaCount=None, location=None, protected=None, link=None, profileImageUrl=None, profileBannerUrl=None, label=None), User(username='gustavohein_', id=890281511630626817, displayname='Gustavo Hein', rawDescription=None, renderedDescription=None, descriptionLinks=None, verified=None, created=None, followersCount=None, friendsCount=None, statusesCount=None, favouritesCount=None, listedCount=None, mediaCount=None, location=None, protected=None, link=None, profileImageUrl=None, profileBannerUrl=None, label=None)]",1401049506,Elladan78,Si he de partir que me parta la vida un amor y transforme mis huesos en flor en algún carnaval...,2013-05-04 00:39:00+00:00,1074,Córdoba,False,1177236146604126208,Convencion_Constituyente_2019_Q4.csv,Convencion_Constituyente
1179300043079090177,2019-10-02 07:40:15+00:00,Catamarca existe. Es como Santa Fe antes de la Convención Constituyente de 1853.,0,0,14,0,es,,,,190133418,nbenassi,,2010-09-13 04:19:26+00:00,809,,False,None,Convencion_Constituyente_2019_Q4.csv,Convencion_Constituyente
1179219857381974018,2019-10-02 02:21:37+00:00,"Curiosidades de la Convención Constituyente de 1853, cuatro convencionales estaban en contra de sancionar una Constitución 😳😳 https://t.co/tEw5gSlMjV",1,3,18,0,es,,,,279334127,AlberdianoArg,"soy todo lo que ustedes quieran, total yo se lo que soy y con eso me alcanza",2011-04-09 02:17:33+00:00,51935,Buenos Aires,False,None,Convencion_Constituyente_2019_Q4.csv,Convencion_Constituyente
1179197165048143877,2019-10-02 00:51:27+00:00,BONUS TRACK: Esto es del diario de sesiones de la Convencion Constituyente de 1853 (atencion al ultimo parrafo) https://t.co/Q2N8MWaRMt,3,3,15,0,es,"Place(id='018f1cde6bad9747', fullName='Ciudad Autónoma de Buenos Aires, Argentina', name='Ciudad Autónoma de Buenos Aires', type='city', country='Argentina', countryCode='AR')",,,279334127,AlberdianoArg,"soy todo lo que ustedes quieran, total yo se lo que soy y con eso me alcanza",2011-04-09 02:17:33+00:00,51935,Buenos Aires,False,1179167759210631168,Convencion_Constituyente_2019_Q4.csv,Convencion_Constituyente
1179180862610591745,2019-10-01 23:46:40+00:00,@JuanCArcandoTDF Muchas gracias por entregarnos la versión taquigráfica de la Convención Constituyente #ushuaia #JornadasNacionalesDerechoAdministrativo @ColantuonoPablo https://t.co/BefkQh84Px,0,1,2,0,es,,"['ushuaia', 'JornadasNacionalesDerechoAdministrativo']","[User(username='ColantuonoPablo', id=3109326303, displayname='Pablo Ángel Gutiérrez Colantuono', rawDescription=None, renderedDescription=None, descriptionLinks=None, verified=None, created=None, followersCount=None, friendsCount=None, statusesCount=None, favouritesCount=None, listedCount=None, mediaCount=None, location=None, protected=None, link=None, profileImageUrl=None, profileBannerUrl=None, label=None)]",1065721261744107521,AADAArgentina,Cuenta Oficial de la Asociación Argentina de Derecho Administrativo.,2018-11-22 21:38:43+00:00,1252,Argentina,False,None,Convencion_Constituyente_2019_Q4.csv,Convencion_Constituyente
1179167670245167105,2019-10-01 22:54:15+00:00,1.- Una de las discusiones más álgidas en la Convención Constituyente de 1853 fue el articulo 4 de la Constitución,5,42,101,9,es,"Place(id='018f1cde6bad9747', fullName='Ciudad Autónoma de Buenos Aires, Argentina', name='Ciudad Autónoma de Buenos Aires', type='city', country='Argentina', countryCode='AR')",,,279334127,AlberdianoArg,"soy todo lo que ustedes quieran, total yo se lo que soy y con eso me alcanza",2011-04-09 02:17:33+00:00,51935,Buenos Aires,False,None,Convencion_Constituyente_2019_Q4.csv,Convencion_Constituyente
